{
  "tenant_id": "tenant-acme",
  "incident_id": "01JINCIDENT000000000000000",
  "status": "investigating",
  "severity": "high",
  "risk_score": 0.91,
  "title": "Checkout egress + auth anomalies",
  "summary_text": "Correlated network beaconing with failed logon burst on checkout hosts",
  "asset_ids": ["asset-checkout-01"],
  "service_ids": ["checkout"],
  "finding_ids": ["01JFINDING0000000000000000", "01JFINDING0000000000000001"],
  "modalities": ["network", "log"],
  "mitre_tactics": ["Command and Control", "Credential Access"],
  "mitre_techniques": ["T1071", "T1110"],
  "labels": ["production", "pci-adjacent"],
  "disposition": null,
  "created_at": "2026-07-27T14:05:00.000Z",
  "created_at_ts": 1785156300,
  "updated_at_ts": 1785156400,
  "expires_at_ts": null,
  "embed_model": "cisco-ai/SecureBERT2.0-biencoder",
  "embed_version": "1",
  "schema_version": "1.0"
}
